title,option1,option2,option3,option4,answer
What is the capital of Mizoram,Kohima,Imphal,Shillong,Aizawl,4
In which year did Goa become a part of India,1960,1961,1962,1963,2
In which year did Dr Abdul Kalam become president of India,2000,2002,2004,2005,2
Which state in India is the largest by area ,Rajasthan,Uttar Pradesh,Maharashtra,Madhya Pradesh,1
What is the capital of the union territory Dadra and Nagar Haveli,Silvassa,Diu,Dadra and Nagar Haveli,Mahe,1
Who is the only president of India to server two terms in Office,Dr Abdul Kalam,Dr Rajendra Prasad,V V Giri,S Radhakrishnan,2
